{
  "slug": "andrew-bayly",
  "name": "Andrew Bayly",
  "researchStatus": "done",
  "lastUpdated": "2026-01-31T11:41:24.363Z",
  "postalAddress": {
    "status": "found",
    "value": "PO Box 528, Pukekohe 2340",
    "source": "https://www3.parliament.nz/media/11976/electorate-and-community-offices-address-as-at-25-september-2025.csv",
    "notes": "Electorate/community office mailing address from Parliament office list CSV (Row: Andrew Bayly MP)."
  },
  "aiInvolvement": {
    "status": "checked",
    "level": "none",
    "evidence": [],
    "notes": "Quick scan of Parliament MP page for AI/technology keywords found nothing obvious."
  },
  "personalizationNotes": null,
  "sourcesChecked": [
    {
      "source": "https://www3.parliament.nz/en/mps-and-electorates/members-of-parliament/andrew-bayly/",
      "checked": true,
      "foundUseful": false,
      "notes": "Webfetch blocked by Radware browser verification. Playwright browser tools unavailable (CDP connect timeout)."
    },
    {
      "source": "https://www3.parliament.nz/en/mps-and-electorates/members-of-parliament/bayly-andrew/",
      "checked": true,
      "foundUseful": true,
      "notes": "Found Parliament Office postal address (Private Bag 18888, Parliament Buildings, Wellington 6160)."
    },
    {
      "source": "https://www3.parliament.nz/en/mps-and-electorates/members-of-parliament/bayly-andrew/#mp-contact-details",
      "checked": true,
      "foundUseful": true,
      "notes": "Confirmed Parliament Office postal address in contact details section (Private Bag 18888, Parliament Buildings, Wellington 6160)."
    },
    {
      "source": "https://www3.parliament.nz/media/11976/electorate-and-community-offices-address-as-at-25-september-2025.csv",
      "checked": true,
      "foundUseful": true,
      "notes": "Found electorate/community office mailing address for Andrew Bayly MP: PO Box 528, Pukekohe 2340."
    },
    {
      "source": "https://www.national.org.nz/team/andrewbayly/contact",
      "checked": true,
      "foundUseful": true,
      "notes": "Found electorate office street address (Port Waikato Electorate Office)."
    }
  ]
}
