{
  "slug": "barbara-edmonds",
  "name": "Barbara Edmonds",
  "researchStatus": "done",
  "lastUpdated": "2026-01-31T09:51:52.032Z",
  "postalAddress": {
    "status": "found",
    "value": "Parliament Office, Private Bag 18888, Parliament Buildings, Wellington 6160",
    "source": "https://www3.parliament.nz/en/mps-and-electorates/members-of-parliament/edmonds-barbara/",
    "notes": "Postal address listed under Contact Details (Parliament Office)"
  },
  "aiInvolvement": {
    "status": "unknown",
    "level": null,
    "evidence": [],
    "notes": null
  },
  "personalizationNotes": null,
  "sourcesChecked": [
    {
      "source": "https://www3.parliament.nz/en/mps-and-electorates/members-of-parliament/edmonds-barbara/",
      "checked": true,
      "foundUseful": true,
      "notes": "Found Parliament Office postal address"
    }
  ]
}
