{
  "slug": "simeon-brown",
  "name": "Simeon Brown",
  "researchStatus": "done",
  "lastUpdated": "2026-01-31T11:03:23.656Z",
  "postalAddress": {
    "status": "found",
    "value": "Pakuranga Electorate Office, 120A Pakuranga Road, Pakuranga, Auckland",
    "source": "https://www.national.org.nz/team/simeonbrown/contact",
    "notes": null
  },
  "aiInvolvement": {
    "status": "checked",
    "level": "none",
    "evidence": [],
    "notes": "Scanned National profile for AI keywords; none found"
  },
  "personalizationNotes": null,
  "sourcesChecked": [
    {
      "source": "https://www.national.org.nz/team/simeonbrown/contact",
      "checked": true,
      "foundUseful": true,
      "notes": "Found Pakuranga Electorate Office street address"
    },
    {
      "source": "https://www.national.org.nz/team/simeonbrown",
      "checked": true,
      "foundUseful": false,
      "notes": "AI keyword scan (none found)"
    }
  ]
}
