{
  "slug": "marama-davidson",
  "name": "Marama Davidson",
  "researchStatus": "done",
  "lastUpdated": "2026-02-01T01:25:00.000Z",
  "postalAddress": {
    "status": "found",
    "value": "Green Party office (authorisation address): Level 5, 108 The Terrace, Wellington",
    "source": "https://www.greens.org.nz/marama_davidson",
    "notes": "Address appears as the authorisation footer on Greens profile page (may be party office rather than electorate office)."
  },
  "aiInvolvement": {
    "status": "checked",
    "level": "none",
    "evidence": [],
    "notes": "Quick scan of Greens profile page found no AI/technology mentions beyond site navigation."
  },
  "personalizationNotes": null,
  "sourcesChecked": [
    {
      "source": "https://www.greens.org.nz/marama_davidson",
      "checked": true,
      "foundUseful": true,
      "notes": "Found postal address in authorisation footer: Level 5, 108 The Terrace, Wellington."
    },
    {
      "source": "https://www.greens.org.nz/marama_davidson",
      "checked": true,
      "foundUseful": false,
      "notes": "AI involvement scan (keywords: AI/artificial intelligence/technology/digital/etc.): no relevant mentions beyond site navigation."
    },
    {
      "source": "https://www3.parliament.nz/en/mps-and-electorates/members-of-parliament/marama-davidson/",
      "checked": true,
      "foundUseful": false,
      "notes": "Playwright navigation failed with net::ERR_HTTP_RESPONSE_CODE_FAILURE (likely 5xx) on 2026-02-01."
    }
  ]
}
