{
  "slug": "chris-bishop",
  "name": "Chris Bishop",
  "researchStatus": "done",
  "lastUpdated": "2026-01-31T11:41:24.365Z",
  "postalAddress": {
    "status": "found",
    "value": "PO Box 30450, Lower Hutt 5040",
    "source": "https://www.national.org.nz/team/chrisbishop/contact",
    "notes": "Lower Hutt electorate office (postal address listed on contact page)."
  },
  "aiInvolvement": {
    "status": "checked",
    "level": "none",
    "evidence": [],
    "notes": "Quick scan of Parliament MP page for AI/technology keywords found nothing obvious."
  },
  "personalizationNotes": null,
  "sourcesChecked": [
    {
      "source": "https://www.national.org.nz/team/chrisbishop/contact",
      "checked": true,
      "foundUseful": true,
      "notes": "Found electorate office postal address (PO Box 30450, Lower Hutt 5040)."
    },
    {
      "source": "https://www3.parliament.nz/en/mps-and-electorates/members-of-parliament/bishop-chris/#mp-contact-details",
      "checked": true,
      "foundUseful": true,
      "notes": "Parliament Office postal address (Private Bag 18888, Parliament Buildings, Wellington 6160) available on Parliament contact details section (kept electorate PO Box as better for physical mail)."
    }
  ]
}
