{
  "slug": "paulo-garcia",
  "name": "Paulo Garcia",
  "researchStatus": "done",
  "lastUpdated": "2026-02-01T00:32:30.4862638+13:00",
  "postalAddress": {
    "status": "found",
    "value": "3069 Great North Road, New Lynn, Auckland",
    "source": "https://www.national.org.nz/team/paulogarcia/contact",
    "notes": "National Party contact page lists New Lynn Office address (hours shown; postcode not shown on page)."
  },
  "aiInvolvement": {
    "status": "checked",
    "level": "none",
    "evidence": [],
    "notes": "Quick scan of National Party contact page did not mention AI or artificial intelligence."
  },
  "personalizationNotes": null,
  "sourcesChecked": []
}
