{
  "slug": "mark-mitchell",
  "name": "Mark Mitchell",
  "researchStatus": "done",
  "lastUpdated": "2026-02-01T01:28:00.000Z",
  "postalAddress": {
    "status": "found",
    "value": "Whangaparāoa Electorate Office: Shop 7, 4 Keith Morris Lane, Orewa 0931",
    "source": "https://www.national.org.nz/team/markmitchell/contact",
    "notes": "Electorate office address listed on National Party MP contact page."
  },
  "aiInvolvement": {
    "status": "checked",
    "level": "none",
    "evidence": [],
    "notes": "Quick scan of National contact page found no AI/technology mentions."
  },
  "personalizationNotes": null,
  "sourcesChecked": [
    {
      "source": "https://www.national.org.nz/team/markmitchell/contact",
      "checked": true,
      "foundUseful": true,
      "notes": "Found electorate office postal address (Shop 7, 4 Keith Morris Lane, Orewa 0931)."
    },
    {
      "source": "https://www.national.org.nz/team/markmitchell/contact",
      "checked": true,
      "foundUseful": false,
      "notes": "AI involvement scan: no relevant AI/tech mentions found on contact page."
    },
    {
      "source": "https://www3.parliament.nz/en/mps-and-electorates/members-of-parliament/mark-mitchell/",
      "checked": true,
      "foundUseful": false,
      "notes": "Playwright navigation failed with net::ERR_HTTP_RESPONSE_CODE_FAILURE (likely 5xx) on 2026-02-01."
    }
  ]
}
