{
  "slug": "willie-jackson",
  "name": "Willie Jackson",
  "researchStatus": "done",
  "lastUpdated": "2026-01-31T11:12:52.5578790Z",
  "postalAddress": {
    "status": "found",
    "value": "Private Bag 18888, Parliament Buildings, Wellington 6160",
    "source": "https://www3.parliament.nz/en/mps-and-electorates/members-of-parliament/jackson-willie/",
    "notes": "Parliament Office address listed under Contact Details"
  },
  "aiInvolvement": {
    "status": "unknown",
    "level": null,
    "evidence": [],
    "notes": null
  },
  "personalizationNotes": null,
  "sourcesChecked": [
    {
      "source": "https://www3.parliament.nz/en/mps-and-electorates/members-of-parliament/jackson-willie/",
      "checked": true,
      "foundUseful": true,
      "notes": "Found Parliament Office postal address (Private Bag 18888, Parliament Buildings, Wellington 6160)"
    }
  ]
}
