{
  "slug": "maureen-pugh",
  "name": "Maureen Pugh",
  "researchStatus": "done",
  "lastUpdated": "2026-01-31T11:56:42.000Z",
  "postalAddress": {
    "status": "found",
    "value": "Hokitika Office: 4 Bert Mercer Drive, Hokitika Airport, Hokitika 7810; Motueka Office: 117 High Street, Motueka",
    "source": "https://www.national.org.nz/team/maureenpugh/contact",
    "notes": "Electorate office street addresses listed on National Party MP contact page (no PO Box shown)."
  },
  "aiInvolvement": {
    "status": "checked",
    "level": "none",
    "evidence": [],
    "notes": "Quick scan of National Party profile page did not mention AI or artificial intelligence."
  },
  "personalizationNotes": null,
  "sourcesChecked": [
    {
      "source": "https://www.national.org.nz/team/maureenpugh/contact",
      "checked": true,
      "foundUseful": true,
      "notes": "Found electorate office addresses (Hokitika; Motueka)."
    },
    {
      "source": "https://www.haveyoursay.org.nz/mp/maureen-pugh",
      "checked": true,
      "foundUseful": true,
      "notes": "Found parliamentary postal address (Freepost Parliament / Private Bag 18 888) as an alternative."
    },
    {
      "source": "https://www.national.org.nz/team/maureenpugh",
      "checked": true,
      "foundUseful": false,
      "notes": "AI keyword scan (artificial intelligence/AI/etc.) - no relevant mentions found."
    }
  ]
}
