{
  "slug": "tracey-mclellan",
  "name": "Tracey McLellan",
  "researchStatus": "done",
  "lastUpdated": "2026-01-31T10:59:13.1538008Z",
  "postalAddress": {
    "status": "found",
    "value": "Private Bag 18888, Parliament Buildings, Wellington 6160",
    "source": "https://www3.parliament.nz/en/mps-and-electorates/members-of-parliament/mclellan-tracey/",
    "notes": "Parliament Office postal address (contact details section)"
  },
  "aiInvolvement": {
    "status": "unknown",
    "level": null,
    "evidence": [],
    "notes": null
  },
  "personalizationNotes": null,
  "sourcesChecked": [
    {
      "source": "https://www3.parliament.nz/en/mps-and-electorates/members-of-parliament/mclellan-tracey/",
      "checked": true,
      "foundUseful": true,
      "notes": "Found Parliament Office postal address (Private Bag 18888, Parliament Buildings, Wellington 6160)."
    }
  ]
}
