{
  "slug": "paul-goldsmith",
  "name": "Paul Goldsmith",
  "researchStatus": "done",
  "lastUpdated": "2026-02-01T00:32:30.4862638+13:00",
  "postalAddress": {
    "status": "found",
    "value": "107 Great South Road, Epsom, Auckland 1051",
    "source": "https://www.national.org.nz/team/paulgoldsmith/contact",
    "notes": "National Party contact page lists MP Office street address."
  },
  "aiInvolvement": {
    "status": "checked",
    "level": "none",
    "evidence": [],
    "notes": "Quick scan of National Party contact page did not mention AI or artificial intelligence."
  },
  "personalizationNotes": null,
  "sourcesChecked": []
}
