{
  "slug": "takuta-ferris",
  "name": "Tākuta Ferris",
  "researchStatus": "done",
  "lastUpdated": "2026-01-31T11:38:49.8685747Z",
  "postalAddress": {
    "status": "found",
    "value": "Private Bag 18888, Parliament Buildings, Wellington 6160",
    "source": "https://www3.parliament.nz/en/mps-and-electorates/members-of-parliament/ferris-t%C4%81kuta/",
    "notes": "Parliament Office postal address listed under Contact Details"
  },
  "aiInvolvement": {
    "status": "checked",
    "level": "none",
    "evidence": [],
    "notes": "Quick scan only; no AI-specific evidence recorded"
  },
  "personalizationNotes": null,
  "sourcesChecked": [
    {
      "source": "https://www.haveyoursay.org.nz/mp/takuta-ferris",
      "checked": true,
      "foundUseful": true,
      "notes": "Found postal address: Freepost Parliament, Private Bag 18 888, Parliament Buildings, Wellington 6160."
    },
    {
      "source": "https://www3.parliament.nz/en/mps-and-electorates/members-of-parliament/ferris-t%C4%81kuta/",
      "checked": true,
      "foundUseful": true,
      "notes": "Found Parliament Office postal address (Private Bag 18888, Parliament Buildings, Wellington 6160) and parliament email address"
    },
    {
      "source": "data/mps.json",
      "checked": true,
      "foundUseful": true,
      "notes": "AI involvement quick scan recorded as none (no AI/tech roles noted in scraped metadata)"
    }
  ]
}
