{
  "slug": "karen-chhour",
  "name": "Karen Chhour",
  "researchStatus": "done",
  "lastUpdated": "2026-01-31T11:37:47.2344295Z",
  "postalAddress": {
    "status": "found",
    "value": "Private Bag 18888, Parliament Buildings, Wellington 6160",
    "source": "https://www3.parliament.nz/en/mps-and-electorates/members-of-parliament/chhour-karen/",
    "notes": "Parliament Office postal address (from Contact Details section)"
  },
  "aiInvolvement": {
    "status": "checked",
    "level": "none",
    "evidence": [],
    "notes": "Quick keyword scan on Parliament profile (AI / artificial intelligence / machine learning / automation / digital) found no relevant mentions."
  },
  "personalizationNotes": null,
  "sourcesChecked": [
    {
      "source": "https://www3.parliament.nz/en/mps-and-electorates/members-of-parliament/chhour-karen/",
      "checked": true,
      "foundUseful": true,
      "notes": "Found Parliament Office postal address: Private Bag 18888, Parliament Buildings, Wellington 6160"
    },
    {
      "source": "https://www3.parliament.nz/en/mps-and-electorates/members-of-parliament/chhour-karen/ (AI keyword scan)",
      "checked": true,
      "foundUseful": false,
      "notes": "No AI-related keyword hits found"
    }
  ]
}
