{
  "slug": "david-macleod",
  "name": "David MacLeod",
  "researchStatus": "done",
  "lastUpdated": "2026-01-31T11:41:24.369Z",
  "postalAddress": {
    "status": "found",
    "value": "New Plymouth Office, 37 Gill Street, New Plymouth; PO Box 8064, New Plymouth 4340",
    "source": "https://www.national.org.nz/team/davidmacleod/contact",
    "notes": "Page lists both physical office address and postal PO Box."
  },
  "aiInvolvement": {
    "status": "checked",
    "level": "none",
    "evidence": [],
    "notes": "Quick scan of Parliament MP page for AI/technology keywords found nothing obvious."
  },
  "personalizationNotes": null,
  "sourcesChecked": [
    {
      "source": "https://www.national.org.nz/team/davidmacleod/contact",
      "checked": true,
      "foundUseful": true,
      "notes": "Found New Plymouth electorate office address and PO Box (includes postcode 4340)."
    },
    {
      "source": "https://www3.parliament.nz/en/mps-and-electorates/members-of-parliament/macleod-david/#mp-contact-details",
      "checked": true,
      "foundUseful": true,
      "notes": "Parliament Office postal address (Private Bag 18888, Parliament Buildings, Wellington 6160) available on Parliament contact details section (kept New Plymouth PO Box 8064, New Plymouth 4340 as best postal address)."
    }
  ]
}
