{
  "slug": "scott-simpson",
  "name": "Scott Simpson",
  "researchStatus": "done",
  "lastUpdated": "2026-01-31T11:37:29.0479825Z",
  "postalAddress": {
    "status": "found",
    "value": "Freepost Parliament, Private Bag 18 888, Parliament Buildings, Wellington 6160",
    "source": "https://www.haveyoursay.org.nz/mp/scott-simpson",
    "notes": "Postal address listed on HaveYourSay MP page"
  },
  "aiInvolvement": {
    "status": "checked",
    "level": "none",
    "evidence": [],
    "notes": "Quick scan only; no AI-specific evidence recorded"
  },
  "personalizationNotes": null,
  "sourcesChecked": [
    {
      "source": "https://www3.parliament.nz/en/mps-and-electorates/members-of-parliament/simpson-scott/",
      "checked": true,
      "foundUseful": true,
      "notes": "Found Parliament Office postal address (Private Bag 18888, Parliament Buildings, Wellington 6160)"
    },
    {
      "source": "https://www.national.org.nz/team/scottsimpson/contact",
      "checked": true,
      "foundUseful": false,
      "notes": "Contact page shows 'Coromandel Electorate Office' but no street/PO Box address displayed (only email)"
    },
    {
      "source": "https://www.haveyoursay.org.nz/mp/scott-simpson",
      "checked": true,
      "foundUseful": true,
      "notes": "Found postal address: Freepost Parliament, Private Bag 18 888, Parliament Buildings, Wellington 6160"
    },
    {
      "source": "data/mps.json",
      "checked": true,
      "foundUseful": true,
      "notes": "AI involvement quick scan recorded as none (no AI/tech roles noted in scraped metadata)"
    }
  ]
}
