{
  "slug": "stuart-smith",
  "name": "Stuart Smith",
  "researchStatus": "done",
  "lastUpdated": "2026-01-31T11:38:18.0793841Z",
  "postalAddress": {
    "status": "found",
    "value": "Blenheim Office, 22 Scott Street, Blenheim; PO Box 130, Blenheim 7240",
    "source": "https://www.national.org.nz/team/stuartsmith/contact",
    "notes": "Office address and PO Box listed on National Party contact page."
  },
  "aiInvolvement": {
    "status": "checked",
    "level": "none",
    "evidence": [],
    "notes": "Quick scan only; no AI-specific evidence recorded"
  },
  "personalizationNotes": null,
  "sourcesChecked": [
    {
      "source": "https://www.national.org.nz/team/stuartsmith/contact",
      "checked": true,
      "foundUseful": true,
      "notes": "Found Blenheim office + PO Box: 22 Scott Street, Blenheim; PO Box 130, Blenheim 7240."
    },
    {
      "source": "data/mps.json",
      "checked": true,
      "foundUseful": true,
      "notes": "AI involvement quick scan recorded as none (no AI/tech roles noted in scraped metadata)"
    }
  ]
}
