{
  "slug": "ryan-hamilton",
  "name": "Ryan Hamilton",
  "researchStatus": "done",
  "lastUpdated": "2026-01-31T11:37:04.7913216Z",
  "postalAddress": {
    "status": "found",
    "value": "Hamilton East Office, Level 2, 697c Wairere Drive, Chartwell, Hamilton 3210",
    "source": "https://www.national.org.nz/team/ryanhamilton/contact",
    "notes": "Electorate office street address listed under 'Offices'"
  },
  "aiInvolvement": {
    "status": "checked",
    "level": "none",
    "evidence": [],
    "notes": "Quick scan only; no AI-specific evidence recorded"
  },
  "personalizationNotes": null,
  "sourcesChecked": [
    {
      "source": "https://www3.parliament.nz/en/mps-and-electorates/members-of-parliament/hamilton-ryan/",
      "checked": true,
      "foundUseful": true,
      "notes": "Found Parliament Office postal address (Private Bag 18888, Parliament Buildings, Wellington 6160)"
    },
    {
      "source": "https://www.national.org.nz/team/ryanhamilton/contact",
      "checked": true,
      "foundUseful": true,
      "notes": "Found electorate office street address: Hamilton East Office, Level 2, 697c Wairere Drive, Chartwell, Hamilton 3210"
    },
    {
      "source": "data/mps.json",
      "checked": true,
      "foundUseful": true,
      "notes": "AI involvement quick scan recorded as none (no AI/tech roles noted in scraped metadata)"
    }
  ]
}
