{
  "slug": "louise-upston",
  "name": "Louise Upston",
  "researchStatus": "done",
  "lastUpdated": "2026-02-01T01:24:00.000Z",
  "postalAddress": {
    "status": "found",
    "value": "Taupō Office: PO Box 280, Taupō 3351 (physical: 67 Paora Hapi Street, Taupō, Waikato 3420)",
    "source": "https://www.national.org.nz/team/louiseupston/contact",
    "notes": "Electorate office (Taupō) listed on National Party MP contact page."
  },
  "aiInvolvement": {
    "status": "checked",
    "level": "none",
    "evidence": [],
    "notes": "Quick scan of National contact page found no AI/technology mentions."
  },
  "personalizationNotes": null,
  "sourcesChecked": [
    {
      "source": "https://www.national.org.nz/team/louiseupston/contact",
      "checked": true,
      "foundUseful": true,
      "notes": "Found electorate office postal address (PO Box 280, Taupō 3351) and physical address (67 Paora Hapi Street, Taupō)."
    },
    {
      "source": "https://www.national.org.nz/team/louiseupston/contact",
      "checked": true,
      "foundUseful": false,
      "notes": "AI involvement scan: no relevant AI/tech mentions found on contact page."
    },
    {
      "source": "https://www3.parliament.nz/en/mps-and-electorates/members-of-parliament/louise-upston/",
      "checked": true,
      "foundUseful": false,
      "notes": "Playwright navigation failed with net::ERR_HTTP_RESPONSE_CODE_FAILURE (likely 5xx) on 2026-02-01."
    }
  ]
}
