{
  "slug": "suze-redmayne",
  "name": "Suze Redmayne",
  "researchStatus": "done",
  "lastUpdated": "2026-01-31T11:38:33.0441346Z",
  "postalAddress": {
    "status": "found",
    "value": "Feilding Electorate Office, 51 Fergusson Street, Feilding 4702; PO Box 335, Feilding 4740",
    "source": "https://www.national.org.nz/team/suzeredmayne/contact",
    "notes": "Electorate office address and PO Box listed on National Party contact page."
  },
  "aiInvolvement": {
    "status": "checked",
    "level": "none",
    "evidence": [],
    "notes": "Quick scan only; no AI-specific evidence recorded"
  },
  "personalizationNotes": null,
  "sourcesChecked": [
    {
      "source": "https://www.national.org.nz/team/suzeredmayne/contact",
      "checked": true,
      "foundUseful": true,
      "notes": "Found Feilding electorate office + PO Box: 51 Fergusson Street, Feilding 4702; PO Box 335, Feilding 4740."
    },
    {
      "source": "data/mps.json",
      "checked": true,
      "foundUseful": true,
      "notes": "AI involvement quick scan recorded as none (no AI/tech roles noted in scraped metadata)"
    }
  ]
}
