{
  "slug": "dan-bidois",
  "name": "Dan Bidois",
  "researchStatus": "done",
  "lastUpdated": "2026-01-31T11:41:24.368Z",
  "postalAddress": {
    "status": "found",
    "value": "Birkenhead Office, 7 Birkenhead Ave, Birkenhead",
    "source": "https://www.national.org.nz/team/danbidois/contact",
    "notes": "Electorate office address listed under Offices."
  },
  "aiInvolvement": {
    "status": "checked",
    "level": "none",
    "evidence": [],
    "notes": "Quick scan of Parliament MP page for AI/technology keywords found nothing obvious."
  },
  "personalizationNotes": null,
  "sourcesChecked": [
    {
      "source": "https://www.national.org.nz/team/danbidois/contact",
      "checked": true,
      "foundUseful": true,
      "notes": "Found office address (street/suburb); postcode not shown on page."
    },
    {
      "source": "https://www3.parliament.nz/en/mps-and-electorates/members-of-parliament/bidois-dan/#mp-contact-details",
      "checked": true,
      "foundUseful": true,
      "notes": "Parliament Office postal address (Private Bag 18888, Parliament Buildings, Wellington 6160) available on Parliament contact details section (kept Birkenhead electorate office street address as better for physical mail)."
    }
  ]
}
